{
  "version": "0.1",
  "catalog_id": "catalog-main-2026-04-13",
  "description": "Example provider catalog for bridge + secret suite",
  "providers": [
    {
      "provider_id": "time-main",
      "kind": "time-authority",
      "product_family": "generic",
      "endpoint_ref": "unix:///run/bridge/time.sock",
      "trust_boundary": "control-plane",
      "capabilities": [
        "authoritative-now"
      ],
      "labels": [
        "core"
      ],
      "fail_closed": true,
      "max_fact_age_s": 5,
      "allowed_modes": [
        "normal",
        "degraded",
        "safe",
        "burn"
      ],
      "requires_durable_audit": false
    },
    {
      "provider_id": "mode-main",
      "kind": "mode-controller",
      "product_family": "generic",
      "endpoint_ref": "unix:///run/bridge/mode.sock",
      "trust_boundary": "control-plane",
      "capabilities": [
        "read-mode",
        "set-burn",
        "set-restore"
      ],
      "labels": [
        "core"
      ],
      "fail_closed": true,
      "max_fact_age_s": 5,
      "allowed_modes": [
        "normal",
        "degraded",
        "safe",
        "burn"
      ],
      "requires_durable_audit": true
    },
    {
      "provider_id": "revoke-main",
      "kind": "revocation",
      "product_family": "generic",
      "endpoint_ref": "https://revocation.internal/v1",
      "trust_boundary": "control-plane",
      "capabilities": [
        "issuer-revocation",
        "jti-revocation",
        "secret-epoch-revocation"
      ],
      "labels": [
        "core"
      ],
      "fail_closed": true,
      "max_fact_age_s": 30,
      "allowed_modes": [
        "normal",
        "degraded",
        "safe",
        "burn"
      ],
      "requires_durable_audit": true
    },
    {
      "provider_id": "attest-main",
      "kind": "attestation",
      "product_family": "spire",
      "endpoint_ref": "unix:///run/bridge/attest.sock",
      "trust_boundary": "identity-plane",
      "capabilities": [
        "verify-workload-posture",
        "verify-host-posture"
      ],
      "labels": [
        "core"
      ],
      "fail_closed": true,
      "max_fact_age_s": 60,
      "allowed_modes": [
        "normal",
        "degraded",
        "safe",
        "burn"
      ],
      "requires_attestation": true,
      "requires_durable_audit": true
    },
    {
      "provider_id": "audit-main",
      "kind": "audit-sink",
      "product_family": "append-only-log",
      "endpoint_ref": "https://audit.internal/v1",
      "trust_boundary": "evidence-plane",
      "capabilities": [
        "append-envelope",
        "checkpoint-stream"
      ],
      "labels": [
        "core"
      ],
      "fail_closed": true,
      "max_fact_age_s": 10,
      "allowed_modes": [
        "normal",
        "degraded",
        "safe",
        "burn"
      ],
      "requires_durable_audit": false
    },
    {
      "provider_id": "audit-emergency-queue",
      "kind": "audit-sink",
      "product_family": "file-sealed-queue",
      "endpoint_ref": "file:///var/lib/bridge-sidecar/queue",
      "trust_boundary": "local-host",
      "capabilities": [
        "append-envelope",
        "reconcile"
      ],
      "labels": [
        "emergency"
      ],
      "fail_closed": true,
      "max_fact_age_s": 10,
      "allowed_modes": [
        "degraded",
        "safe",
        "burn"
      ],
      "requires_durable_audit": false
    },
    {
      "provider_id": "vault-dynamic-main",
      "kind": "secret-backend",
      "product_family": "vault",
      "endpoint_ref": "https://vault.internal/v1",
      "trust_boundary": "secret-authority",
      "capabilities": [
        "issue-dynamic",
        "renew-lease",
        "revoke-lease"
      ],
      "labels": [
        "db",
        "dynamic"
      ],
      "fail_closed": true,
      "max_fact_age_s": 30,
      "allowed_modes": [
        "normal",
        "degraded",
        "safe"
      ],
      "requires_attestation": true,
      "requires_durable_audit": true
    },
    {
      "provider_id": "kms-envelope-main",
      "kind": "secret-backend",
      "product_family": "aws-kms",
      "endpoint_ref": "https://kms.internal/v1",
      "trust_boundary": "secret-authority",
      "capabilities": [
        "decrypt",
        "encrypt",
        "generate-data-key"
      ],
      "labels": [
        "kms"
      ],
      "fail_closed": true,
      "max_fact_age_s": 30,
      "allowed_modes": [
        "normal",
        "degraded",
        "safe"
      ],
      "requires_attestation": true,
      "requires_durable_audit": true
    },
    {
      "provider_id": "hsm-proxy-main",
      "kind": "secret-backend",
      "product_family": "pkcs11-hsm",
      "endpoint_ref": "unix:///run/bridge/hsm.sock",
      "trust_boundary": "secret-authority",
      "capabilities": [
        "sign",
        "decrypt",
        "proxy-operation"
      ],
      "labels": [
        "signing",
        "non-exportable"
      ],
      "fail_closed": true,
      "max_fact_age_s": 30,
      "allowed_modes": [
        "normal",
        "degraded",
        "safe"
      ],
      "requires_attestation": true,
      "requires_durable_audit": true
    },
    {
      "provider_id": "keychain-local",
      "kind": "secret-backend",
      "product_family": "apple-keychain",
      "endpoint_ref": "keychain://login",
      "trust_boundary": "local-host",
      "capabilities": [
        "resolve-bootstrap-reference"
      ],
      "labels": [
        "bootstrap",
        "local-only"
      ],
      "fail_closed": true,
      "max_fact_age_s": 60,
      "allowed_modes": [
        "normal",
        "degraded",
        "safe"
      ],
      "requires_attestation": false,
      "requires_durable_audit": true
    },
    {
      "provider_id": "systemd-cred-main",
      "kind": "materializer",
      "product_family": "systemd-credential",
      "endpoint_ref": "unix:///run/bridge/systemd.sock",
      "trust_boundary": "local-host",
      "capabilities": [
        "materialize-systemd-credential",
        "teardown-on-exit"
      ],
      "labels": [
        "systemd"
      ],
      "fail_closed": true,
      "max_fact_age_s": 10,
      "allowed_modes": [
        "normal",
        "degraded",
        "safe"
      ],
      "requires_attestation": true,
      "requires_durable_audit": true
    },
    {
      "provider_id": "agent-proxy-main",
      "kind": "materializer",
      "product_family": "agent-proxy",
      "endpoint_ref": "unix:///run/bridge/agent.sock",
      "trust_boundary": "local-host",
      "capabilities": [
        "materialize-agent-proxy",
        "bounded-handle"
      ],
      "labels": [
        "proxy"
      ],
      "fail_closed": true,
      "max_fact_age_s": 10,
      "allowed_modes": [
        "normal",
        "degraded",
        "safe"
      ],
      "requires_attestation": true,
      "requires_durable_audit": true
    },
    {
      "provider_id": "unix-socket-proxy-main",
      "kind": "materializer",
      "product_family": "unix-socket-proxy",
      "endpoint_ref": "unix:///run/bridge/proxy.sock",
      "trust_boundary": "local-host",
      "capabilities": [
        "materialize-unix-socket-proxy",
        "non-exportable-operation"
      ],
      "labels": [
        "proxy",
        "non-exportable"
      ],
      "fail_closed": true,
      "max_fact_age_s": 10,
      "allowed_modes": [
        "normal",
        "degraded",
        "safe"
      ],
      "requires_attestation": true,
      "requires_durable_audit": true
    },
    {
      "provider_id": "memfd-pass-main",
      "kind": "materializer",
      "product_family": "memfd-pass",
      "endpoint_ref": "unix:///run/bridge/memfd.sock",
      "trust_boundary": "local-host",
      "capabilities": [
        "materialize-memfd",
        "teardown-on-exit"
      ],
      "labels": [
        "memory-only"
      ],
      "fail_closed": true,
      "max_fact_age_s": 10,
      "allowed_modes": [
        "normal",
        "degraded",
        "safe"
      ],
      "requires_attestation": true,
      "requires_durable_audit": true
    }
  ]
}
